Show Number,Air Date,Round,Category,Value,Question,Answer
3460,1999-09-24,Double Jeopardy!,CANADIAN TOURISM,$600,"Each year this British Columbia city hosts the Symphony of Fire, a 4-day fireworks extravaganza",Vancouver
4200,2002-11-29,Jeopardy!,I GET NO KICK FROM CAMPAIGN,$1000,"The only Republican presidential nominee to lose twice, his running mate the 2nd time was Earl Warren",Dewey
4605,2004-09-17,Double Jeopardy!,BRING OUT YOUR DEAD,$800,"The alternate title to the Anne Rice book ""Ramses the Damned"" mentions one of these previously buried folk",a mummy
6288,2012-01-11,Jeopardy!,CATHOLIC PRIESTS,$600,"The priest's duty to keep your sins secret is traditionally protected by ""the sanctity of"" this booth",the confessional
4083,2002-05-08,Double Jeopardy!,TOUGH GEOGRAPHY,$1600,This last colony in Africa shares part of its name with a desert & is claimed by Morocco,Western Sahara
3760,2000-12-29,Double Jeopardy!,START SAVING NOW,$400,"The ""Hope""ful, priceless object, seen here, is this type of gem",(the Hope) diamond
3234,1998-10-01,Jeopardy!,POTPOURRI,$500,Deneb is the brightest star in this constellation whose name means swan,Cygnus
5970,2010-07-23,Jeopardy!,IT'S A LONG WAY TO TIPPERARY,$200,"First, get yourself to New York, Chicago or Boston & hop on this Irish airline that first flew on May 27, 1936",Aer Lingus
5604,2009-01-08,Double Jeopardy!,IT'S A FACT,$400,It's the capital of Montana,Helena
3678,2000-09-06,Double Jeopardy!,PEA,"$1,500",He began monk-ing around with garden peas in 1856,Gregor Mendel
5668,2009-04-08,Double Jeopardy!,PRO CHEERLEADER SQUADS,$800,In the AFC East: The Flight Crew,the (New York) Jets
6191,2011-07-11,Double Jeopardy!,BORN & DIED,$2000,"Born in Germany in 1685, he tuned out April 14, 1759 in London",Handel
4256,2003-02-17,Double Jeopardy!,BAD NEWS,$400,"Hillsborough, a neutral stadium, was the site of a fatal 1989 stampede at this type of British sporting event",soccer match
5766,2009-10-12,Jeopardy!,ANAGRAMS INC.,$1000,You can bank on it: FLOWER GALS,Wells Fargo
4507,2004-03-23,Double Jeopardy!,NANA,$1600,"Puu Nana is a peak on this island, home to Hawaii's leprosy treatment center",Molokai
4764,2005-04-28,Double Jeopardy!,GEOLOGY,$1200,"This landmark in Rio's Guanabara Bay is an axample of an inselberg, or ""island mountain""",Sugar Loaf Mountain
6113,2011-03-23,Jeopardy!,FAMOUS PAIRS,$200,"Born just days apart in 1951, in 1976 they opened their first ice cream shop in a renovated gas station in Vermont",Ben & Jerry
4194,2002-11-21,Jeopardy!,POETS & POETRY,$600,"For writing the pamphlet ""The Necessity of Atheism"", this ""Ode to the West Wind"" poet was expelled from Oxford",Percy Shelley
3567,2000-02-22,Jeopardy!,"""K"" MART",$300,"In 1883 more than 36,000 died following an explosion on this volcanic Indonesian island",Krakatoa
4513,2004-03-31,Jeopardy!,ARCHAIC WORDS,$600,"What was once chiropody, the health field dealing with the feet, is now more commonly called this",podiatry
5393,2008-02-06,Double Jeopardy!,FAMOUS FATHERS,$400,"""The Father of the Declaration of Independence""",Thomas Jefferson
3282,1998-12-08,Final Jeopardy!,ORGANIZATIONS,None,"Now with over a hundred chapters, the March of Dimes was first established by this president",Franklin Delano Roosevelt
6065,2011-01-14,Double Jeopardy!,SHAKESPEARE'S TRAGIC ENDINGS,$2000,"Richmond kills the title king & ends this play saying, ""Peace lives again: that she may long live here, God say amen!""",Richard III
3015,1997-10-10,Double Jeopardy!,SPEARS,$1000,The British used these cavalry troops in the Sikh & Afghan Wars & to crush the Sepoy Rebellion,Bengal Lancers
6240,2011-11-04,Double Jeopardy!,"MAPMAKER, MAPMAKER","$2,000","However you draw the border between Nicaragua & this 2-named country, somebody gets mad, huh?",Costa Rica
5392,2008-02-05,Jeopardy!,"""TOO"" MUCH",$400,"It's a signal at night for soldiers to go to their quarters, or an indelible pattern drawn on the skin",a tattoo
5452,2008-04-29,Jeopardy!,"""B"" YOUR BEST",$200,"Yes, Bubbe, it's a headscarf worn by Russian women, or a term for a Russian grandmother",a babushka
3178,1998-05-27,Double Jeopardy!,FICTIONAL CHARACTERS,$200,Get too close to this beloved of Quasimodo & he might just ring your bell,Esmeralda
3984,2001-12-20,Jeopardy!,"A ""C.D."" CATEGORY",$400,"(<a href=""http://www.j-archive.com/media/2001-12-20_J_12.jpg"" target=""_blank"">Cheryl of the Clue Crew delivers the clue.</a>)  <a href=""http://www.j-archive.com/media/2001-12-20_J_12a.jpg"" target=""_blank"">This</a> is the spicy treat that fits the category",a chili dog
4196,2002-11-25,Double Jeopardy!,SPECIAL EFFECTS,$1600,5-letter word for an explosive used to lend realism to cinematic gunplay,squib
3236,1998-10-05,Jeopardy!,EX-BUNNIES,$500,"Working her way through college as ""Bunny Sue"", she's now working as Dharma's mother-in-law",Susan Sullivan
3740,2000-12-01,Jeopardy!,BOOKS OF THE BIBLE,$400,"""And when he opened the seventh seal, there was silence in heaven about the space of half an hour""",Revelation
4260,2003-02-21,Jeopardy!,AMERICAN CITIES,$600,The final draft of the U.S. Constitution was composed in this city in September 1787,Philadelphia
3154,1998-04-23,Double Jeopardy!,GOOD WILL SHAKESPEARE,$800,"In London, Shakespeare boarded with the Mountjoys, a family of these French Protestants",Huguenots
4886,2005-12-05,Jeopardy!,ART FOR ART'S SAKE,$800,"She's the Pennsylvania-born expatriate whose work is seen <a href=""http://www.j-archive.com/media/2005-12-05_J_16.jpg"" target=""_blank"">here</a>",(Mary) Cassatt
4331,2003-06-02,Double Jeopardy!,HAVE YOU HEARD THE WORD?,$2000,"The name of this cold, treeless region where reindeer thrive comes from a Russian word for ""flat-topped hill""",tundra
5952,2010-06-29,Double Jeopardy!,"""Z"" IS FOR...",$2000,This Babylonian temple tower,a ziggurat
5803,2009-12-02,Double Jeopardy!,THE WAY IN,$2000,An Internet site that offers e-mail & a search engine is called one of these entryways to the web,a portal
1319,1990-05-03,Jeopardy!,TWINS,$200,A Minnesota Twin could tell you this word is a synonym for twin bill,Doubleheader
5054,2006-07-27,Jeopardy!,THE 2005 GREENSBORO MAYORAL RACE,$200,"Vote did he get, this 900-year-old ""Star Wars"" character",Yoda
5689,2009-05-07,Jeopardy!,PSYCH!,$400,The study of how individual differences are inherited or environmentally caused is known as behavior these,genetics
2963,1997-06-18,Jeopardy!,PROHIBITION,$300,"As the 1932 Democratic candidate for president, he promised to end prohibition",Franklin D. Roosevelt
3079,1998-01-08,Jeopardy!,ADVENTURE HEROES,$500,First names of detective Fenton Hardy's adventurous sons,Frank & Joe
1250,1990-01-26,Jeopardy!,POLITICAL TERMS & SLOGANS,$400,"In 1936 Republicans said, ""Let's get another deck"" in response to this program",The New Deal
5122,2006-12-12,Jeopardy!,NOT TO BE CONFUSED,$1000,"Alimony is what you pay to an ex; this is a brittle silvery-white metallic element, atomic no. 51",antimony
4848,2005-10-12,Jeopardy!,SHAKE YOUR TAIL FEATHER,$200,"It's the large, swift bird seen <a href=""http://www.j-archive.com/media/2005-10-12_J_16.jpg"" target=""_blank"">here</a>",an ostrich
4784,2005-05-26,Jeopardy!,THAT'S WRITE!,$600,"From the Latin for ""to write across"", it's making a written copy of dictated material",transcribe
4977,2006-04-11,Jeopardy!,TAKE A HIKE,$200,There's good hiking at several stops on this country's mountainous Chihuahua al Pacifico train,Mexico
2909,1997-04-03,Jeopardy!,ANIMALS,$100,The Tiger Swallowtail & Zebra Swallowtail are species of this insect,Butterfly
2947,1997-05-27,Double Jeopardy!,MORE DYSFUNCTIONAL ROYAL FAMILIES,$400,Henry II kept this woman of Aquitaine locked up for years after she & his sons rebelled against him,Eleanor
3909,2001-09-06,Jeopardy!,AS QUOTED IN NEWSWEEK,$300,"An NYU student said of this Clinton foe, ""He's obviously a better teacher than he is a special prosecutor""",Ken Starr
4786,2005-05-30,Jeopardy!,SPORTS 2004,$400,"All ""Hale"" this 58-year-old who won his fourth Senior PGA championship by a str--a shot",Hale Irwin
5787,2009-11-10,Jeopardy!,"""TEXT"" ME",$200,This system of linking Internet documents contains cross-references so you can jump easily between them,hypertext
3516,1999-12-13,Double Jeopardy!,ANIMALS IN SHOWBIZ,$400,"Perhaps the world's only spokesfish, he swims in Starkist ads",Charlie the Tuna
5169,2007-02-15,Double Jeopardy!,GOVERNMENT & POLITICS,$2000,The Office of English Language Acquisition belongs to this cabinet department,Department of Education
2966,1997-06-23,Double Jeopardy!,THE 16TH CENTURY,$800,In 1533 Henry VIII's marriage to Catherine of Aragon ended & this Catherine wed the future Henry II of France,Catherine de' Medici
4876,2005-11-21,Jeopardy!,AMERICANA,$400,"This missionary nurseryman did most of his work in Ohio & Indiana, where he died in 1845",Johnny Appleseed
6258,2011-11-30,Double Jeopardy!,"HELP ME, FONDA",$800,Jane Fonda helps Michael Douglas uncover hazards at a nuclear power plant in this 1979 blockbuster,The China Syndrome
2619,1996-01-11,Jeopardy!,TV BARS & RESTAURANTS,$400,On this sitcom you may find the Crane brothers having coffee at Cafe Nervosa,"""Frasier"""
4636,2004-11-01,Jeopardy!,AMERICAN HISTORY,$1000,"Seen <a href=""http://www.j-archive.com/media/2004-11-01_J_13.jpg"" target=""_blank"">here</a> at a Senate hearing, he was the first U.S. Attorney General to be convicted of a felony",John Mitchell
4690,2005-01-14,Jeopardy!,A IS FOR...,$600,"...Aesop, who gave us the moral ""the gods help them that"" do this",help themselves
3334,1999-02-18,Final Jeopardy!,MODERN AFRICAN HISTORY,None,"Africa's newest independent state, it was an Italian colony until WWII, & later incorporated into another country",Eritrea (formerly part of Ethiopia)
4639,2004-11-05,Jeopardy!,SUNSHINE,$800,The energy we call sunshine is initially generated by the Sun's fusion of hydrogen into this,helium
3914,2001-09-13,Jeopardy!,WORLD WAR II IN PICTURES,$400,"<a href=""http://www.j-archive.com/media/2001-09-13_J_25.jpg"" target=""_blank"">This band leader</a>'s plane disappeared on a trip to Paris in December 1944",Glenn Miller
5007,2006-05-23,Double Jeopardy!,"""TRUTH"" OR CONSEQUENCES",$1200,"Winston Smith works for this ironically named government unit in the novel ""1984""",the Ministry of Truth
3415,1999-06-11,Double Jeopardy!,HUMANITARIANS,$400,"He used some of his enormous wealth to build a New York City concert hall & over 2,500 public libraries",Andrew Carnegie
1158,1989-09-20,Double Jeopardy!,BOOKS & AUTHORS,$200,"This state was the setting for Edna Ferber's novel ""Ice Palace""",Alaska
5876,2010-03-15,Jeopardy!,A PIECE OF HISTORY,$600,Apollo astronauts collected 841 pounds of these (most are stored at Johnson space center),Moon rocks
2340,1994-11-04,Double Jeopardy!,DRAMA,$800,"In a 1922 Anne Nichols play, he marries an Irish girl named Rose Mary Murphy, starting a family feud",Abie
3263,1998-11-11,Double Jeopardy!,THE 13 COLONIES,$600,This colony's western boundary with Maryland was surveyed by Mason & Dixon in 1764,Delaware
1654,1991-11-07,Jeopardy!,BODIES OF WATER,$200,The Navy shipyard at Bremerton in Washington state is on this inlet of the Pacific,Puget Sound
3175,1998-05-22,Double Jeopardy!,A LITTLE BITTY COUNTRY,$1000,"Luxembourg is one-third of this economic union that was set up November 1, 1960",BENELUX
5994,2010-10-07,Jeopardy!,IF THE TV SERIES HAD A DOWNER ENDING,$400,"Boss Hogg has the General Lee impounded on dozens & dozens of felony evading arrest charges, then car-crushes it",The Dukes of Hazzard
5501,2008-07-07,Double Jeopardy!,CHRIS COLUMBUS,$1200,Chris directed the first & second installments of this Macaulay Culkin franchise,Home Alone
4032,2002-02-26,Jeopardy!,"TOO ""HARD""",$400,"It's a lightweight, protective helmet used by construction workers",a hard hat
2619,1996-01-11,Jeopardy!,INVENTORS,$300,Thomas Hancock patented vulcanized rubber in England the year before this man in the U.S.,Charles Goodyear
4209,2002-12-12,Double Jeopardy!,BASES LOADED,$1200,This island at the southern tip of South Carolina is a major Marine Corps training base,Parris Island
3531,2000-01-03,Jeopardy!,ENGLISH SHIPS,$500,In 1791 the HMS Pandora sailed into Tahiti to seize several of this ship's crew,the Bounty
5504,2008-07-10,Jeopardy!,ON A JET PLANE,$400,"It's the 2-word slang term for what is formally known as ""time zone change syndrome""",jet lag
3439,1999-07-15,Jeopardy!,10 CDs FOR A PENNY,$400,"I bought this Beatle's ""Dark Horse"" & Ravi Shankar's ""In Celebration"", which he co-produced",George Harrison
5367,2008-01-01,Jeopardy!,TEMPO TANTRUM,$1000,"This common name of the small speedy bird seen <a href=""http://www.j-archive.com/media/2008-01-01_J_30.jpg"" target=""_blank"">here</a> even means ""speedy""",swift
3614,2000-04-27,Jeopardy!,COLORFUL WORDS & PHRASES,$500,It's the NFL team that plays its home games at Lambeau Field,Green Bay Packers
3664,2000-07-06,Jeopardy!,APPLE,$500,This thickener of fruit jellies is obtained from apples,pectin
422,1986-04-22,Double Jeopardy!,GOVERNMENT,$600,"He, not the Attorney General, represents the government in cases before the Supreme Court",the Solicitor General of the U.S.
3263,1998-11-11,Double Jeopardy!,ART & ARTISTS,$1000,The name of this art style is derived from a Paris shop opened in the 1890s by dealer Siegfried Bing,Art Nouveau
4357,2003-07-08,Jeopardy!,ASIAN NATIONS,$200,In 1949 a Nationalist government in exile was established in this Asian island nation,Taiwan
3363,1999-03-31,Double Jeopardy!,"RUSSIAN ""T"" ROOM",$200,"His writing career began with the short novel ""Detstvo"" in 1852; the much longer pieces came later",Leo Tolstoy
3097,1998-02-03,Jeopardy!,THE BEE,$400,On their heads bees have 5 of these -- 2 compound & 3 simple,Eyes
5361,2007-12-24,Jeopardy!,EUROPEAN PARLIAMENT MEMBERS,$200,Eoin Ryan of this country is also a member of the Fianna Fail political party,Ireland
3840,2001-04-20,Double Jeopardy!,NEW JERSEYITES,$800,"This director of ""Lone Star"", ""Passion Fish"" & ""Return of the Secaucus Seven"" has long been based in Hoboken",John Sayles
4992,2006-05-02,Double Jeopardy!,"WHAT THE ""H""?",$2000,This Tasmanian capital was once a major center for Antarctic whalers,Hobart
2865,1997-01-31,Jeopardy!,VALENTINE'S DAY,$200,"He told the 20th Communist Party Congress Feb. 14, 1956 that war with capitalist imperialism was not inevitable",Nikita Khrushchev
5344,2007-11-29,Double Jeopardy!,FROM PAGE TO SCREEN,$800,"(<a href=""http://www.j-archive.com/media/2007-11-29_DJ_12.jpg"" target=""_blank"">Hi, I'm Sean Hayes.</a>)  I got one of my first big breaks when I was cast in the film ""A & P"", based on a story by this ""Rabbit, Run"" author",John Updike
5764,2009-10-08,Jeopardy!,ENDS WITH THE SAME 2 LETTERS,$1000,The pilgrimage to Mecca for Muslims,hajj
2815,1996-11-22,Double Jeopardy!,POSTAGE STAMPS,$800,A U.S. stamp from 1965 commemorated the 700th anniversary of the birth of this Italian poet,Dante Aligheri
4903,2005-12-28,Double Jeopardy!,CLEVELAND ROCKS!,$400,The original theme song to this TV sitcom set in Cleveland mentioned the nearby towns of Parma & Solon,The Drew Carey Show
3237,1998-10-06,Jeopardy!,FOR YOUR EYES ONLY,$100,"As you'd expect, it's the term for bifocals modified with an additional lens for intermediate distance",Trifocals
4256,2003-02-17,Double Jeopardy!,U.S. CITIES,$400,It's home to the NFL's Panthers,Charlotte
1425,1990-11-09,Double Jeopardy!,GILBERT & SULLIVAN,$800,"This opera is subtitled ""The Lass that Loved a Sailor""",The H.M.S. Pinafore
3090,1998-01-23,Jeopardy!,FILM DIRECTORS,$500,This Japanese crime organization attacked Juzo Itami after he made a 1992 film satirizing them,the Yakuza
1266,1990-02-19,Final Jeopardy!,ANCIENT HISTORY,None,"Crassus, Julius Caesar & this man formed the 1st Triumvirate",Pompey
3504,1999-11-25,Jeopardy!,LEFTOVERS,$400,"Before their royal wedding, Edward & Sophie were given the titles Earl & Countess of this",Wessex
2992,1997-09-09,Double Jeopardy!,QUESTIONS,$1000,"The second half of Senator Howard Baker's 1973 question that began, ""What did the president know?""","""And when did he know it?"""
2994,1997-09-11,Jeopardy!,ACTOR-DIRECTORS,$400,"In 1990 he directed himself in the title role of ""Dick Tracy""",Warren Beatty
5675,2009-04-17,Double Jeopardy!,BORROWED BOOK TITLES,$400,"This Steinbeck novel title comes from Genesis; Cain went there, to the land of Nod, after the murder",East of Eden
4155,2002-09-27,Jeopardy!,2-LETTER SCRABBLE WORDS,$600,A part of the psyche,id
4461,2004-01-19,Jeopardy!,MR. BUSINESSMAN,$600,"Put them in the order Richard Branson founded them: airline, record store, record label","record store, record label, airline"
5347,2007-12-04,Double Jeopardy!,HISTORIC NAMES,$1200,"This Apache tried to keep peace with the palefaces, but after his death, his son joined with the militant Geronimo",Cochise
5946,2010-06-21,Jeopardy!,ANNUAL EVENTS,$800,In the 1840s Esther Howland made these cards from imported paper lace & floral decorations,Valentines
3150,1998-04-17,Double Jeopardy!,500 YEARS AGO,$800,"On May 20, 1498 this Portuguese navigator reached Calicut on the Malibar coast of India",Vasco da Gama
4535,2004-04-30,Jeopardy!,EUROPEAN HISTORY,$400,A protest at a church in Timisoara began the rebellion that ended Ceausescu's rule in this country,Romania
3018,1997-10-15,Double Jeopardy!,AMERICAN HERSTORY,$400,"She wrote, ""I knew then that 'W-A-T-E-R' meant the ... cool something that was flowing over my hand""",Helen Keller
5072,2006-10-03,Double Jeopardy!,"MOM, I WANT I WANT I WANT!!",$800,"I want this ""lunar"" footwear, basically a pair of trampolines, to make me feel like I'm defying gravity",moon shoes
5410,2008-02-29,Jeopardy!,FOR SAX AND VIOLINS,$200,"Charlie Daniels reported a fiddle of gold was bet against a soul when ""The Devil Went Down To"" this state",Georgia
3622,2000-05-09,Jeopardy!,U.S. RIVERS,$200,Lake Texoma on the Texas-Oklahoma border was formed by damming this river,Red River of the South
5709,2009-06-04,Double Jeopardy!,THE ROYAL ONTARIO MUSEUM,$400,"(<a href=""http://www.j-archive.com/media/2009-06-04_DJ_26.jpg"" target=""_blank"">Alex reads from the Royal Ontario Museum in Canada.</a>)  <a href=""http://www.j-archive.com/media/2009-06-04_DJ_26a.jpg"" target=""_blank"">This</a> bust, once identified as just an early Ptolemaic queen, has now been shown to be this woman--famous through the ages",Cleopatra
3311,1999-01-18,Jeopardy!,AMERICA SINCE 1900,$500,"These towns, like the one seen here, were named for a 1950s builder",Levittowns
5339,2007-11-22,Double Jeopardy!,THE SCIENCE OF LIQUOR,$1600,Jameson Irish Whiskey gains its golden hue thanks partly to this acid that also helps give leather its color,tannic acid
3559,2000-02-10,Jeopardy!,SIGNS & SYMBOLS,$200,The cross seen here is used as a symbol in the battle against this disease abbreviated TB:,Tuberculosis
5346,2007-12-03,Jeopardy!,RELIGION,$400,"As part of Catholic Baptism, this word doesn't mean to go to the gym but to get rid of demons",exorcise
5250,2007-06-08,Double Jeopardy!,BARRE TENDERS,$2000,"This ballerina known for her ""Dying Swan"" role starred in the 1915 silent film ""The Dumb Girl of Portici""",Pavlova
4393,2003-10-15,Double Jeopardy!,AWARDS,$800,Britain's 200-year-old Rumford Medal is given for discoveries about heat or this form of energy,light
4244,2003-01-30,Jeopardy!,WHERE AM I?,$200,"(Jimmy of the Clue Crew)  I'm in this city, at the very first of thousands of Starbucks stores",Seattle
3621,2000-05-08,Jeopardy!,FOREWORDS,$200,"This 1955 novel's foreword says, ""I have no intention to glorify 'H.H.'....he is a shining example of moral leprosy""",Lolita
5477,2008-06-03,Jeopardy!,CLASSIC ADS & JINGLES,$400,"This cereal is ""A honey of an O""",Honey-Nut Cheerios
735,1987-11-13,Jeopardy!,ANIMALS,$500,"Types of this aquatic creature include chimney, sheep's wool, and common bath",the sponge
3668,2000-07-12,Jeopardy!,SID & MARTY KROFFT TV,$100,"On their Krofft-produced variety show, Marie Osmond was ""a little bit country"" & Donny was ""a little bit"" this",rock and roll
3772,2001-01-16,Jeopardy!,NHL TEAMS,$500,The team that wears the logo seen here plays home games in this former Olympic venue (Calgary Flames),Saddledome
2628,1996-01-24,Double Jeopardy!,WORLD CITIES,"$2,500",This Swiss city is headquarters to the World Council of Churches,Geneva
5189,2007-03-15,Double Jeopardy!,U.S. LAKES & RIVERS,$400,Oregon is in deep with this body of water on its state quarter,Crater Lake
3213,1998-07-15,Double Jeopardy!,BOOKS FOR THE BRAVE,$800,"It's a lot easier to finish this author's ""Death in Venice"" than his ""Dr. Faustus""",Thomas Mann
3273,1998-11-25,Double Jeopardy!,THOMAS PAINE,$800,"Paine took on religion in his book ""The Age Of"" this",Reason
6237,2011-11-01,Jeopardy!,WORDS CONTAINING BODY PARTS,$400,"These ""notes"" are used illicitly to help you on tests",crib notes
4795,2005-06-10,Jeopardy!,SALT,$200,In 1930 this Indian pacifist marched 200 miles to the sea to protest Britain's salt tax,Gandhi
6224,2011-10-13,Jeopardy!,ONE GOOD TURN,"$2,000",Sharp type of turn that sounds like an accessory to keep your toupee from flying off,a hairpin
4903,2005-12-28,Double Jeopardy!,CLEVELAND ROCKS!,$1200,"Kim Deal, Faith Hill & Vanilla Ice have been spotted at this attraction on the shores of Lake Erie",the Rock & Roll Hall of Fame
5376,2008-01-14,Double Jeopardy!,THE SPORTS ZONE,$1200,This fabled stadium where the Pittsburgh Pirates & Steelers used to play was demolished in 2001,Three Rivers
5996,2010-10-11,Double Jeopardy!,JERSEY GIRLS,$400,"Doing laundry in the sink, this ""Jersey Shore"" girl aka Nicole Polizzi said, ""I feel like a pilgrim from the friggin' '20s""",Snooki
6098,2011-03-02,Jeopardy!,THE WORLD,$600,"The trail named for these people led from Cuzco to Intipunku, ""the gateway of the sun"", & on to Machu Picchu",the Incans
4823,2005-07-20,Double Jeopardy!,BIBLICAL QUOTES,$400,"The Lord told him to ""Lift thou up thy rod, and stretch out thine hand over the sea, and divide it""",Moses
3158,1998-04-29,Double Jeopardy!,SEVEN,$600,"It's the title of the movie seen <a href=""http://www.j-archive.com/media/1998-04-29_DJ_20.wmv"">here</a>",The Seven Year Itch
5239,2007-05-24,Double Jeopardy!,HAIFA LOAF,$800,Haifa was a target of scud missiles from this country during the Persian Gulf War of 1991,Iraq
6000,2010-10-15,Jeopardy!,CABLE CHANNELS,"$1,000","This cable channel launched on Feb. 2, 2000--appropriately, that's 02/02",the Oxygen Channel
3722,2000-11-07,Jeopardy!,WORLD OF WORDS,$200,In Hebrew it can mean hello. goodbye or well-being,Shalom
6219,2011-10-06,Double Jeopardy!,ANGRY WORDS,$2000,These Greek female divinities punished crimes at the instigation of the victims,the furies
2352,1994-11-22,Jeopardy!,EUROPEAN CAPITALS,$200,"These animals, a symbol of the city of Bern, are kept in a pit near the river",bears
2857,1997-01-21,Double Jeopardy!,HERBS & SPICES,$200,Hungarians have many dishes named for & made with this spice,paprika
733,1987-11-11,Jeopardy!,GIRLS IN SONG,$100,"In various songs, she was a hit for Jimmy Clanton, Shocking Blue, Bananarama, and Frankie Avalon",Venus
5131,2006-12-25,Double Jeopardy!,GRAMMAR,$800,"The sentence ""Harold and Kumar go to White Castle"" has a plural compound one of these",a subject
4992,2006-05-02,Jeopardy!,LARGE EQUIPMENT,$200,"A hoisting machine, or a somewhat similar-looking wading bird",a crane
4369,2003-09-11,Double Jeopardy!,L'HOMME,$400,One of Louis Malle's first jobs in filmmaking was an assistant to this marine explorer,Jacques Cousteau
3747,2000-12-12,Double Jeopardy!,HURRY UP!,"$2,000","It's the perfect British ""street"" to report on naval maneuvers",Fleet Street
6262,2011-12-06,Double Jeopardy!,HUD SECRETARIES,$800,"HUD secretary under Nixon, he earlier served as American Motors president & sired a candidate for U.S. president",George Romney
4894,2005-12-15,Double Jeopardy!,A FOXY CATEGORY,$1600,"In an Aesop fable, Fox makes this bird drop its food by asking it to speak",Crow
4761,2005-04-25,Jeopardy!,THE ARTIST,$800,"16th century author Pietro Aretino is <a href=""http://www.j-archive.com/media/2005-04-25_J_15.jpg"" target=""_blank"">seen</a> <a href=""http://www.j-archive.com/media/2005-04-25_J_15a.jpg"" target=""_blank"">here</a> in a portrait by this Venetian pal of his",Titian
4646,2004-11-15,Jeopardy!,PITTSTORY,$400,"It's the geographically appropriate name of the Pittsburgh landmark seen <a href=""http://www.j-archive.com/media/2004-11-15_J_02.jpg"" target=""_blank"">here</a> on Feb. 11, 2001",Three Rivers Stadium
6284,2012-01-05,Jeopardy!,ARMY STRONG,$1000,"In August 2010 General Zahir Azimi announced that its army had reached target strength of 134,000 2 months ahead of schedule",Afghanistan
2236,1994-05-02,Jeopardy!,BUSINESS & INDUSTRY,$200,This company operates the 4 most popular theme parks in North America,Disney
1227,1989-12-26,Double Jeopardy!,POETRY,$200,"A 19th century rhyme says, ""He who does not love wine, women & "" this ""remains a fool his whole life long""",Song
2378,1994-12-28,Jeopardy!,RULES FROM EXODUS,$300,"One of the commandments says ""Thou shalt not bear"" this ""against thy neighbor""","""false witness"""
4903,2005-12-28,Double Jeopardy!,"""GON"" TOMORROW",$1600,This aromatic herb used in cooking bears clusters of small green & white flowers,tarragon
5476,2008-06-02,Double Jeopardy!,ART,$1200,We're not joshing--in 1769 this portrait painter got knighted,(Joshua) Reynolds
5612,2009-01-20,Double Jeopardy!,"ENDS IN ""GHT""",$800,"It can precede man, arrow & shooter",straight
4901,2005-12-26,Double Jeopardy!,ROYALTY,$1200,She became queen of England in 1702 after a riding accident led to the death of William III,Queen Anne
2737,1996-06-25,Jeopardy!,WORLD CITIES,$500,It's said this North Korean capital is the Korean Peninsula's oldest city,Pyongyang
