Show Number,Air Date,Round,Category,Value,Question,Answer
963,1988-11-09,Jeopardy!,MOVIE TRIVIA,$400,"Though he was best known for directing musicals, the last film he directed was a drama, ""Star 80""",Bob Fosse
4860,2005-10-28,Double Jeopardy!,20th CENTURY LITERATURE,$400,"This 1949 novel features a society dominated by such slogans as ""War is peace, freedom is slavery, ignorance is strength""",1984
1250,1990-01-26,Jeopardy!,PEOPLE,$200,"In 1975 Mr. Blackwell called this ""Cuchi Cuchi"" girl ""Carmen Miranda with cleavage""",Charo
4183,2002-11-06,Double Jeopardy!,NORSE MYTHOLOGY,$1200,"A never-ending supply of this better-than-beer drink was made by Heidrum, oddly a goat, not a bee",mead
5257,2007-06-19,Jeopardy!,LITERARY MOUNTAINS,$600,"In a Hemingway tale, Harry gets gangrene; before he dies, has a vision of flying in a plane toward this mountain",Kilimanjaro
4872,2005-11-15,Jeopardy!,STEP INTO THE STUDY,$200,"Myology is the study of these, like biceps",muscles
4083,2002-05-08,Double Jeopardy!,TOUGH GEOGRAPHY,$1200,"This Argentine region's name is Spanish for ""big feet"", perhaps because Spaniards saw Indians who wore large boots",Patagonia
3849,2001-05-03,Double Jeopardy!,"""OFF""ERINGS",$600,"Differing from the usual or expected, or a description of bad drumming",offbeat
68,1984-12-12,Jeopardy!,INVENTIONS,$300,1899 device for attaching papers that can ruin a computer disc when magnetized,a paper clip
3641,2000-06-05,Double Jeopardy!,_____&____,$400,This phrase comes from birds rubbing their beaks together & making amorous noises,Bill & coo
3563,2000-02-16,Jeopardy!,RADIO WAVES,$300,This word dating back to the 1940s refers to a program aired at the same time on radio & TV,Simulcast
4768,2005-05-04,Jeopardy!,ATTILA THE HUN,$400,"In 341 Attila conquered, then abandoned, this town in Gaul where 961 years later a certain ""maid"" was born",Orléans
3576,2000-03-06,Jeopardy!,HORROR MOVIE VILLAINS,$300,"""Friday the 13th"" parts 2 through 9",Jason
5748,2009-09-16,Double Jeopardy!,"T""OIL""",$400,A cheap novel written quickly just to make money,a potboiler
5967,2010-07-20,Jeopardy!,"HELLO, DOLL-Y",$600,"Mattel has announced 2 new ""I Can Be..."" dolls of her: news anchor & computer engineer",Barbie
2885,1997-02-28,Jeopardy!,U.S. GEOGRAPHY,$500,It's the oldest city in Kansas; a federal penitentiary lies within the city limits,Leavenworth
4619,2004-10-07,Jeopardy!,POLL VAULT,$200,A 1951 survey of the U.S. Armed Forces found this milk & grain concoction their least favorite dessert,rice pudding
5362,2007-12-25,Double Jeopardy!,KEVIN-SENT,$1600,"In one film he said Lee Harvey Oswald acted alone; in another, he played a lawyer determined to prove the opposite",Kevin Costner
4633,2004-10-27,Jeopardy!,"""J"" WALKING",$200,In medieval times this country was known as Cipango,Japan
5990,2010-10-01,Double Jeopardy!,BRANDS WE LOST,$1600,Bristol-Meyers Squibb discontinued its Nuprin brand of this,pain reliever
4227,2003-01-07,Jeopardy!,ENGLISH CLASS,$400,"This part of speech doesn't always end in ""ly""; once, there & often are other examples",adverb
4622,2004-10-12,Double Jeopardy!,COMEDY CENTRAL,$400,Adjective meaning completely expressionless used to describe Jackie Vernon’s or Steven Wright’s comic style,deadpan
3058,1997-12-10,Jeopardy!,HOODS,$300,"According to his TV theme, he's ""feared by the bad, loved by the good""",Robin Hood
3458,1999-09-22,Double Jeopardy!,CONNERY...SEAN CONNERY,$400,It was Sean's first James Bond film,Dr. No
3214,1998-07-16,Jeopardy!,20th CENTURY INVENTION,$500,They were invented in 1947 & by the 1990s millions were being placed on a single chip,Transistors
4807,2005-06-28,Jeopardy!,"""X"" RATED",$600,William B. Davis played the mysterious Cigarette-Smoking Man on this Fox show,The X-Files
5334,2007-11-15,Jeopardy!,FINANCE,$800,"It's often set up by the wealthy for their kids, but California has a state children's one for poor folks",a trust fund
4707,2005-02-08,Jeopardy!,TEEN PEOPLE,$1000,"Following Nelly, Chingy is the latest big star out of this city's rap scene",St. Louis
5729,2009-07-02,Jeopardy!,MEDICAL PREFIXES & SUFFIXES,$200,"Following lump- & tonsil(l)-, it denotes a surgical removal",-ectomy
3263,1998-11-11,Jeopardy!,SEPTEMBER 1984,$400,He celebrated his 15th year in power in Libya September 1,Muammar Qadhafi
5576,2008-12-01,Double Jeopardy!,SHAKESPEARE,$1200,"In this play Guildenstern says, ""O, there has been much throwing about of brains""",Hamlet
6149,2011-05-12,Double Jeopardy!,BROKEN ENGLISH,$1200,"It can precede bean, fastener or dragon",snap
2752,1996-07-16,Jeopardy!,EUROPEAN HISTORY,$400,"Except for a brief time, this birthplace of Christopher Columbus was ruled by a doge from 1339-1797",Genoa
4241,2003-01-27,Double Jeopardy!,GOLF TALK,"$1,500",(Peter Jacobsen gives the clue)  Douglas MacArthur would know this term for an intentional slice,fade
3932,2001-10-09,Double Jeopardy!,FACTS ON FILE,$400,(Cheryl of the Clue Crew reports from the Santa Monica Pier)  These planes named after their wing configurations were flown by the Wright Bros. but disappeared after World War II,biplanes
5673,2009-04-15,Final Jeopardy!,EXPLORERS,None,"In 1611 Henry Greene led a successful mutiny against this captain, but soon after was killed by Eskimos",Henry Hudson
3395,1999-05-14,Double Jeopardy!,SOUTHERN CALIFORNIA,$1000,"Dana Point is named for Richard Henry Dana, best known for this ""timely"" memoir about sailing to California & back","""Two Years Before the Mast"""
4853,2005-10-19,Double Jeopardy!,OCCUPATIONAL TV,$1600,Jim Anderson was an agent at the General Insurance Company on this sitcom,Father Knows Best
5178,2007-02-28,Jeopardy!,DAVID,$1000,David is anointed king in the second book of this prophet,Samuel
2038,1993-06-16,Double Jeopardy!,U.S. GOVERNMENT,$200,"After 182 years, the Post Office Department ceased to exist in 1971 & was replaced by this agency",The US Postal Service
1250,1990-01-26,Jeopardy!,"""G"" WHIZ",$400,"Figuratively speaking, to prepare for action you do this to your loins",gird
2128,1993-12-01,Jeopardy!,PHOTOGRAPHERS,$200,"in 1980, Jimmy Carter awarded this landscape photographer the Presidential Medal of Freedom",Ansel Adams
3002,1997-09-23,Jeopardy!,CHER FILMS,$200,This film featured Cher as Meryl Streep's gal pal & co-worker at a nuclear plant,Silkwood
6067,2011-01-18,Jeopardy!,BURGER JOINTS,$200,"Hamburger University, this chain's training center, opened in 1961 in Elk Grove Village, Illinois",McDonald's
4795,2005-06-10,Jeopardy!,"10-, 11- & 12-LETTER WORDS",$200,"Travel to Springfield, Mass. & you can make a fast break for the Naismith Hall of Fame for this sport",basketball
3921,2001-09-24,Jeopardy!,THE AGE OF AQUARIUMS,$400,"Seen <a href=""http://www.j-archive.com/media/2001-09-24_J_29.jpg"" target=""_blank"">here</a>, the beluga type of this mammal is one of the main attractions at Chicago's Shedd Aquarium",a whale
4236,2003-01-20,Jeopardy!,WATERFOWL,$600,Most domestic ducks descend from this wild species in which the male has a glossy green head & white neck ring,mallard
3153,1998-04-22,Double Jeopardy!,"TAKE ""TEN""",$800,Notable Nepalese Norgay,Tenzing Norgay
1651,1991-11-04,Double Jeopardy!,U.S . GOVERNMENT,$200,Life forms created in the laboratory can be registered with this Commerce Department office,Patent Office
4561,2004-06-07,Jeopardy!,I DID IT!,$200,Florence Chadwick was the first woman to swim this in both directions; Gertrude Ederle swam it one way,the English Channel
4617,2004-10-05,Double Jeopardy!,"DO YA THINK I'M ""SEX""Y?",$400,This 6-letter term means designed for both men & women,unisex
5755,2009-09-25,Jeopardy!,"""CENTER"" FIELD",$200,"It's where you might find Johnny Gilbert in the next issue of ""Playgirl""",the centerfold
3840,2001-04-20,Double Jeopardy!,THE KNIGHTS TEMPLAR,$600,"By arresting them all & seizing their property in 1307, this country's Philip IV began the suppression of the Templars",France
3897,2001-07-10,Double Jeopardy!,OPERA,$400,"In 1829, after his move to Paris, this Italian composer wrote ""William Tell""",Gioachino Rossini
3794,2001-02-15,Jeopardy!,GEMS & JEWELRY,$100,"This world-famous blue gem is named for one of its former owners, Henry Philip Hope",Hope Diamond
2911,1997-04-07,Jeopardy!,STATE BIRDS,$100,This red-breasted state bird of Connecticut lays 3 to 6 blue eggs 2 or 3 times a year,the robin
3673,2000-07-19,Double Jeopardy!,ANGELS,$200,In 1996 John Travolta spread his wings as this archangel,Michael
3970,2001-11-30,Double Jeopardy!,PHILOSOPHERS,$2000,"Jacques Lacan revised this philosopher's idea as ""Where I think, 'I think, therefore I a",Rene Descartes
3561,2000-02-14,Jeopardy!,ENTERTAINING CATS,$300,This colorful big cat has been bopping to a Henry Mancini theme since 1963,The Pink Panther
3698,2000-10-04,Double Jeopardy!,RHYME TIME,$800,A map of your blood-pumping organ,heart chart
3057,1997-12-09,Double Jeopardy!,ACTORS & THEIR ROLES,$1000,In 1997 Johnny Depp went undercover to infiltrate the Mafia in this film based on a true story,Donnie Brasco
4661,2004-12-06,Jeopardy!,THE WAR BETWEEN THE STATES,$600,"This ""Ben-Hur"" author was removed from command and reinstated twice",Lew Wallace
4745,2005-04-01,Double Jeopardy!,SOUTHERN CALIFORNIA ARCHITECTURE,$400,"The Jet Age Building seen <a href=""http://www.j-archive.com/media/2005-04-01_DJ_16.jpg"" target=""_blank"">here</a> is the hub for this transportation complex",LAX
5138,2007-01-03,Double Jeopardy!,WHO'S YOUR DADDY?,$1200,Angelina Jolie,Jon Voight
3117,1998-03-03,Jeopardy!,OUR WRITERS' FAVORITE COMIC BOOKS,$100,Both of these female friends of Archie Andrews have their own comics & share a third,Betty & Veronica
5400,2008-02-15,Jeopardy!,VWLLSS FLWRS,$400,PTN,petunia
5529,2008-09-25,Double Jeopardy!,THE 20th CENTURY,$2000,"In May 1966 this small South American country became independent, with Forbes Burnham as its first P.M.",Guyana
4580,2004-07-02,Double Jeopardy!,"""SUMMER"" FUN",$400,"After Stockholm hosted these in 1912, Sweden's Hugo Wieslander was awarded a disputed gold in the decathlon",the Summer Olympics
6185,2011-07-01,Jeopardy!,AD SLOGANS,$1000,"""It only does everything""",Sony Playstation
2835,1996-12-20,Double Jeopardy!,BLACK AMERICANS,$800,In 1888 a Boston monument was erected to honor this man & 4 others who died in the Boston Massacre,Crispus Attucks
6124,2011-04-07,Jeopardy!,DISNEY FILM BY CHARACTER,$400,"Mr. Smee, a first mate (1953)",Peter Pan
4615,2004-10-01,Double Jeopardy!,CALCULUS,$2000,"Related to the word ""increase"", it's a small change in a variable representing distance or time",increment
4122,2002-07-02,Double Jeopardy!,"CATCHING SOME ""Z""s",$1600,"This ""Master of the Pan Flute"" has sold millions of albums worldwide",Zamfir
3734,2000-11-23,Double Jeopardy!,"TURKMENISTAN, THE COUNTRY",$1000,"Fresh water is tough to get; this large ""sea"" forming the western border is salt water",the Caspian Sea
5023,2006-06-14,Double Jeopardy!,AN ATOMIC CATEGORY,$2000,"These subatomic particles come in 6 flavors, including up, down & strange",quarks
5599,2009-01-01,Double Jeopardy!,GET SOME CULTURE,$400,The Norton Simon Museum in Pasadena has this type of garden where you can see 3-dimensional works,a sculpture garden
4929,2006-02-02,Jeopardy!,IF THEY MARRIED...,$800,"Mary, co-host of ""E.T."", weds Watergate ""Deep Throat"" W. Mark & hyphenates to get this sincere name",Mary Hart-Felt
4731,2005-03-14,Jeopardy!,SHADES OF BROWN,$800,A potato & a winter apple with a rough brownish skin have this brown name,russet
4546,2004-05-17,Jeopardy!,SCHOOL OF ROCK MOVIES,$1000,"(<a href=""http://www.j-archive.com/media/2004-05-17_J_30.jpg"" target=""_blank"">Hi.  I'm Vivica Fox.</a>)  I played one of Frankie Lymon's wives in this movie bio, also the title of Frankie's biggest hit",Why Do Fools Fall in Love
5326,2007-11-05,Double Jeopardy!,CRIME TIME,$1200,"While he was never convicted of murder, Al Capone did spend 8 years in prison for this crime",tax evasion
5160,2007-02-02,Jeopardy!,ISLAND HOPPING,$400,"Little dots of nothing called the Shag Rocks lie about 700 miles east of these islands, subject of a 1980s conflict",the Falklands
5649,2009-03-12,Jeopardy!,LONDON LANDMARKS,$800,"<a href=""http://www.j-archive.com/media/2009-03-12_J_22.jpg"" target=""_blank"">This</a> place has your ticket to concerts and sporting events",Wembley Stadium
2236,1994-05-02,Jeopardy!,SCIENCE,$300,Term for the time it takes a radioactive substance to decay to 50% of its original quantity,half-life
3034,1997-11-06,Jeopardy!,mini-mountains,$400,"A women's college in South Hadley, Massachusetts is named for this nearby 878' mount",Mount Holyoke
5529,2008-09-25,Jeopardy!,CHARLIE WILSON'S WAR WORDS,$600,"HALO, standing for ""high altitude, low opening"", is an acronym used in the operation of these",parachutes
4130,2002-07-12,Jeopardy!,THE FORTUNE 500,$800,AMR & UAL are the top 2 companies in this industry,airline
3456,1999-09-20,Double Jeopardy!,CHOCK FULL O' NUTS,$200,"In ""Nuts"" she was a hooker accused of murder who fought to stand trial rather than be declared insane",Barbra Streisand
4857,2005-10-25,Jeopardy!,ABBA-SOLUTELY FABULOUS,$200,"Made up of Frida Lyngstad, Agnetha Faltskog, Bjorn Ulvaeus & Benny Andersson, ABBA hails from this country",Sweden
5993,2010-10-06,Jeopardy!,GAME TIME,$800,"Bump, slide & switch until someone gets all the way home in this game whose name is a word I often use",Sorry
1281,1990-03-12,Double Jeopardy!,19TH CENTURY AMERICANS,$400,In 1850 this showman began promoting U.S. tours for opera singer Jenny Lind,P.T. Barnum
3070,1997-12-26,Double Jeopardy!,WOMEN OF THE WORLD,$400,French film star Simone Signoret married 2 men named Yves:  director Yves Allegret & this actor,Yves Montand
1271,1990-02-26,Double Jeopardy!,THEATER,"$2,000","Songs from this 1965 musical include ""The Dubbing"" & ""Dulcinea""","""Man of La Mancha"""
4522,2004-04-13,Jeopardy!,BIOLOGY,$200,3 calves created this way made headlines back in 1988,cloning
4973,2006-04-05,Jeopardy!,MOVIE TEENAGERS,$1000,Hilary Duff was part of Steve Martin & Bonnie Hunt's big family in this 2003 comedy--& its 2005 sequel,Cheaper by the Dozen
4563,2004-06-09,Double Jeopardy!,THE ANCIENTS SPEAK,$2000,"He said he was ""looking for an honest man""",Diogenes
5186,2007-03-12,Jeopardy!,IT'LL BE A COLD DAY IN HELENA,$200,"Of 25,000, 250,000 or 500,000, the approximate population of Helena, Montana","25,000"
4390,2003-10-10,Jeopardy!,WOMEN IN MUSIC,$1000,"She's the songwriter extraordinaire of the hits ""How Do I Live"" & ""I Don't Want to Miss a Thing""",Diane Warren
6059,2011-01-06,Double Jeopardy!,LANGUAGE OF ORIGIN,$400,"Hallelujah,  sabbath",Hebrew
5637,2009-02-24,Double Jeopardy!,THE MUSIC MAN'S INSTRUMENT,$2000,Lionel Hampton,vibraphone
3830,2001-04-06,Double Jeopardy!,RELIGIOUS LEADERS,$1000,The beginnings of this religious group came around 1647 with the preaching of George Fox of England,Quakers (Society of Friends)
4733,2005-03-16,Double Jeopardy!,AVIATION,$2000,"On October 4, 2004 this private craft won the $10 million Ansari X Prize by reaching space for the 2nd time within a week",SpaceShipOne
4910,2006-01-06,Jeopardy!,ADVERBS,$1000,"Actually, in the strict sense without inaccuacy or exaggeration, it's this 9-letter adverb",literally
4853,2005-10-19,Double Jeopardy!,WORLD WAR I,$2000,This controversial Army officer led the air operations of the AEF & flew many missions deep into enemy territory,(Billy) Mitchell
3840,2001-04-20,Double Jeopardy!,NAME THE MOVIE,$800,"1992: ""You be sweet to your wife.  My husband wasn't sweet to me and look how I turned out""",Thelma & Louise
5068,2006-09-27,Double Jeopardy!,BRIDGING THE LITERARY GAP,$400,Robert James Waller: “The Bridges of ______”,Madison County
5745,2009-07-24,Double Jeopardy!,MARTIAL,$2000,"Royce Gracie won the first 2 of these, UFC for short, featuring masters of different martial arts",Ultimate Fighting Championship
5514,2008-07-24,Double Jeopardy!,PAUL REVERE,$1200,"While practicing this profession, Revere advertised devices ""of real use in speaking and eating""",dentistry
4586,2004-07-12,Jeopardy!,"ON THE ""ROAD"" AGAIN",$800,"Swift American seen <a href=""http://www.j-archive.com/media/2004-07-12_J_19.jpg"" target=""_blank"">here</a>",the roadrunner
3593,2000-03-29,Jeopardy!,"CROSSWORD CLUES ""G""",$500,"Dressy dress, or cap's partner (4)",Gown
3601,2000-04-10,Double Jeopardy!,SCIENCE,$600,"NaOCl, sodium hypochlorite, is this common laundry product",Bleach
5664,2009-04-02,Double Jeopardy!,BEFORE HE WAS PRESIDENT...,$1600,He defeated the Creek in the 1814 Battle of Horseshoe Bend,(Andrew) Jackson
3334,1999-02-18,Jeopardy!,TEA TIME,$400,"Tea is also grown on this island, whose name is synonymous with coffee",Java
6060,2011-01-07,Jeopardy!,"TAKING STOCK, SYMBOLICALLY",$600,"This company, WMT, employs 2.1 million associates worldwide & is the largest private employer in Mexico",Walmart
4905,2005-12-30,Jeopardy!,CONTAINERS,$200,Stages in Chicken of the Sea tuna processing include thawing; evisceration; cleaning; & filling & sealing these,cans
3936,2001-10-15,Double Jeopardy!,TITLES TAKEN FROM SHAKESPEARE,$200,"Sonnet 30, line 2 by Proust",Remembrance of Things Past
3766,2001-01-08,Jeopardy!,"""CAT""ECHISM",$100,"A large, important church; great ceiling!",Cathedral
4196,2002-11-25,Jeopardy!,CANADIAN HISTORY,$800,"This institution, the NFB, founded by Parliament in 1939, added an animation department in 1942",National Film Board of Canada
4733,2005-03-16,Double Jeopardy!,____ OF THE ____,$2000,"They're the personal bodyguard of the British monarch, though their duties are ceremonial",the Yeomen of the Guard
4366,2003-09-08,Double Jeopardy!,RWANDA,$1600,"Now with a population of about 300,000, this city became the capital upon Rwanda's independence",Kigali
5868,2010-03-03,Double Jeopardy!,CHANGE A LETTER,$1600,"Change a letter in ""half"" & you get this word meaning ""robust""",hale
3506,1999-11-29,Double Jeopardy!,RUSSIAN CITIES,$200,"By the 15th C., this city was capital of the Russian state & the seat of the Russian Orthodox Church",Moscow
5785,2009-11-06,Jeopardy!,THEM'S FIGHTIN' WORDS!,$1000,"This 3-letter word means to poke abruptly, as with the point of a stick",jab
5719,2009-06-18,Jeopardy!,FAST FOOD CHAINS IN OTHER WORDS,$200,Belonging to Peter Pan's Ms. Darling,Wendy's
5723,2009-06-24,Double Jeopardy!,FOLSOM PRISON BLUES,$800,"Now a cliche about prison life, these automobile identifiers have been manufactured at Folsom since 1947",license plates
6203,2011-07-27,Jeopardy!,"THE ""SOCIAL"" NETWORK",$800,"S.A.D. can stand for this psychological condition, a fear of being humiliated in front of others",the social anxiety disorder
3652,2000-06-20,Jeopardy!,BODIES OF WATER,$300,Latvia's capital shares its name with this nearby gulf,Gulf of Riga
4305,2003-04-25,Double Jeopardy!,THE LABORS OF HERCULES,$400,Hercules used these flying weapons to shoot down the Stymphalian birds,arrows
2777,1996-10-01,Jeopardy!,LASTS,$200,"Their last joint operetta, ""The Grand Duke"", premiered in 1896",Gilbert & Sullivan
5131,2006-12-25,Double Jeopardy!,AUTHORS,$2000,Henry Chinaski was the alter ego of this late hard-living California poet,(Charles) Bukowski
5628,2009-02-11,Double Jeopardy!,WHAT A COUNTRY!,$1600,"The world's oldest tango festival, the Tangomarkkinat, is held annually in this northern European country",Finland
3134,1998-03-26,Double Jeopardy!,AMERICANA,$200,Its index finger is 8 feet long; its tablet over 23 feet,Statue of Liberty
4811,2005-07-04,Jeopardy!,SMELLS LIKE TEAM SPIRIT,$200,"Often called ""football in the water"", this sport is played by teams of 7",water polo
2515,1995-07-07,Double Jeopardy!,1938,$600,17 acres surrounding her cottage were transferred to the Shakespeare Birthplace Trust,Anne Hathaway
5189,2007-03-15,Double Jeopardy!,FILL IN THE AUTHOR'S NAME,$1600,Henry ______ Haggard,Rider
6253,2011-11-23,Double Jeopardy!,AS I RECALL,$2000,Millions of these made from 1995 to 2007 for kids were recalled; the MTV show of the same name is still safe,cribs
4967,2006-03-28,Jeopardy!,YANKEE STADIUM,$600,"(<a href=""http://www.j-archive.com/media/2006-03-28_J_24.jpg"" target=""_blank"">Sarah of the Clue Crew reads from the stands of Yankee Stadium in the Bronx, New York.</a>)  I'm in the Yankee Stadium section where, in 1977, <a href=""http://www.j-archive.com/media/2006-03-28_J_24a.jpg"" target=""_blank"">this man</a>'s third home run of World Series game six landed; all were hit on the first pitch",Reggie Jackson
6291,2012-01-16,Jeopardy!,"TAKE IT ""SLOW""",$800,"""Layla"" guitarist's lazy moniker",Slowhand
3100,1998-02-06,Jeopardy!,3-LETTER WORDS,$100,Tongues & tails do it,Wag
307,1985-11-12,Double Jeopardy!,U. S. STATES,$1000,Meredith Willson modeled his “River City” on his home town of Mason City in this state,Iowa
5814,2009-12-17,Jeopardy!,IN PLAIN SIGHT,$400,No wonder it's so long--it was built over 2 millennia across northern China & southern Mongolia,the Great Wall of China
3399,1999-05-20,Jeopardy!,CLASSIC SITCOMS,$500,In 1977 this character left his job at Prendergast Tool & Die & purchased Kelsey's Bar,Archie Bunker
3976,2001-12-10,Double Jeopardy!,ARTISTS & THEIR SUBJECTS,$1600,This American known for his mobiles also created a wire portrait of Josephine Baker,Alexander Calder
5312,2007-10-16,Jeopardy!,"FISH, BIRD OR MAMMAL",$400,The tarsier,a mammal
3331,1999-02-15,Jeopardy!,WORDS WITHIN WORDS,$300,"A 1,496-pound one was unfortunate enough to get caught in 1979",Tuna (unforTUNAte)
3910,2001-09-07,Jeopardy!,STATE THE OBVIOUS,$100,"<a href=""http://www.j-archive.com/media/2001-09-07_J_02.jpg"" target=""_blank"">[State outline]</a>",Nebraska
4989,2006-04-27,Jeopardy!,WORD & PHRASE ORIGINS,$200,"This evergreen tree was named for Scottish botanist David Douglas, who collected samples in America",the Douglas fir
4239,2003-01-23,Jeopardy!,STUPID ANSWERS,$800,"Kodiak Island is the habitat of this type of bear, Ursus arctos middendorffi",Kodiak bear
3613,2000-04-26,Jeopardy!,"""SUB"" CATEGORY",$400,Examples of these are protons & neutrons,Subatomic particles
4294,2003-04-10,Double Jeopardy!,NBA TEAMS IN OTHER WORDS,$800,The male deer,the (Milwaukee) Bucks
5210,2007-04-13,Jeopardy!,LITERARY FILL IN THE BLANK,$400,"Malory: ""And right as Arthur did at Christmas, he did at Candlemas, and pulled out the _____ easily""",the sword
3452,1999-09-14,Double Jeopardy!,COLONIAL AMERICA,$400,Coins of this European country were those most frequently used in colonial America,Spain (pieces of eight)
3184,1998-06-04,Double Jeopardy!,BOTTOMS UP!,$200,It's the base in the liqueur Irish Mint,Irish whiskey
4278,2003-03-19,Double Jeopardy!,FEDERAL AID PROGRAMS,$1600,"The National School Lunch Program comes from this dept., also concerned with foot-and-mouth disease",Agriculture
3918,2001-09-19,Double Jeopardy!,LITTLE ROCK,"$1,300",Pebbles called gastroliths are found in this part of a bird that goes through a daily grind,the gizzard
5263,2007-06-27,Jeopardy!,SYMBOLOGY,$1000,"Ichthys, the Greek word for this symbol of Christ, is a Greek acronym for ""Jesus Christ, Son of God, Savior""",a fish
3282,1998-12-08,Double Jeopardy!,THE MOVIES,$800,"In this 1957 film Elvis played Vince Everett, an ex-con who develops a recording career",Jailhouse Rock
3225,1998-09-18,Double Jeopardy!,SHALL WE DANCE?,$400,"Famous ""forbidden dance"" featured in 2 1990 films",Lambada
6199,2011-07-21,Jeopardy!,ACTRESSES' TRESSES,$200,"Veronica Lake's haircut that covered one eye was this style, also the name of a game played with small children",a peekaboo
1276,1990-03-05,Jeopardy!,"STARTS WITH ""B""",$500,"2-word French term for a small bundle of herbs, often tied together & used for flavoring",Bouquet Garni
5113,2006-11-29,Double Jeopardy!,LET'S SING,$800,"John Lennon song with the lyrics ""We all shine on like the moon and the stars and the sun""","""Instant Karma"""
1317,1990-05-01,Jeopardy!,THINK TWICE,$500,Most Chinese gooseberries are grown in this country,New Zealand (AKA the Kiwi Fruit)
5758,2009-09-30,Jeopardy!,CLASSIC VIDEO GAMES,$800,"The original name for the hero was Jumpman, & he was a carpenter, not a plumber, in <a href=""http://www.j-archive.com/media/2009-09-30_J_09.wmv"">this</a> game",Donkey Kong
1498,1991-02-20,Double Jeopardy!,ISLANDS,$600,Qishm and Bahrain are the largest inhabited islands in this gulf,Persian Gulf
5896,2010-04-12,Jeopardy!,"HI, BOB",$600,"The onscreen & offscreen antics of this ""Hogan's Heroes"" star inspired the 2002 film ""Auto Focus""",Bob Crane
3201,1998-06-29,Jeopardy!,LET'S SPLIT,$300,"If you're doing this you're making superfine distinctions, so don't wig out",Splitting hairs
2353,1994-11-23,Jeopardy!,20TH CENTURY AMERICA,$300,In 1948 the results of his studies of sexual behavior in the human male were published,Alfred Kinsey
5585,2008-12-12,Jeopardy!,"GYPSIES, TRAMPS & THIEVES",$1000,In 1911 Vincenzo Perugia stole this painting from the Louvre; he was caught trying to sell it to an antiques dealer,the Mona Lisa
3492,1999-11-09,Jeopardy!,NONPOTENT POTABLES,$500,A New York company makes a line of flavored tea that shares its name with this Western state,Arizona
4618,2004-10-06,Jeopardy!,TV WEAPONS,$1000,"Yancy Butler as Sara Pezzini wielded this title sword that's a mystical, shape-shifting talisman of power",Witchblade
3467,1999-10-05,Jeopardy!,FICTIONAL BARTENDERS,$100,Boston bar owned by Sam Malone,Cheers
3312,1999-01-19,Double Jeopardy!,THE THEATRE,$800,"""Swimming To Cambodia"" monologist who starred in the aptly-titled one-man show ""Gray's Anatomy""",Spalding Gray
1147,1989-09-05,Double Jeopardy!,THE BIBLE,$400,"A believer in the pagan god Baal, her name has come to mean a wicked, shameless woman",Jezebel
3275,1998-11-27,Double Jeopardy!,"""KISS""ING MUSIC",$200,"According to the lyrics, this ""May be quite continental, but diamonds are a girl's best friend""",A kiss on the hand
3816,2001-03-19,Jeopardy!,THE ART OF WAR,$200,It's the 1836 battle captured here by Kirk Stirnweis,The Alamo
